"tweet_id"	"author"	"entity_id"	"text"
"94711599620820992"	"SafetyTweety"	"RL2013D03E087"	"Corporate Volunteer Days - Stanford Scout Camp Site http://bit.ly/n1oMVb"
"94721892421861377"	"lpgatwax"	"RL2013D03E087"	"Now leading at -9 in the Evian Masters: Angela Stanford http://tinyurl.com/3gvyqzq #lpga"
"94723330170564609"	"batonflipper"	"RL2013D03E087"	"Hubert Parry & Charles Villiers Stanford, English Table Tennis Doubles Champions 1888,89 & 91 #music #fact"
"94749386109763584"	"leewanta"	"RL2013D03E087"	"""Mind Control Operations at Stanford Research Institute"" http://su.pr/2qqVSn "
"94763439444082689"	"JonRothstein"	"RL2013D03E087"	"Early PAC-12 rankings 1. UCLA 2. Washington 3. Cal 4. Zona 5. Oregon 6. Stanford 7. USC 8. Wash State 9. ASU 10. Colorado 11. OSU 12. Utah"
"94775394980466688"	"PoliciadeTwit"	"RL2013D03E087"	"Rethinking Lists, Groups and Circles: Editor's note: Yoav Shoham is professor of computer science at Stanford Un... http://bit.ly/oxSCGQ"
"94789508800851968"	"BenGalavizFeeds"	"RL2013D03E087"	"Rethinking Lists, Groups and Circles: Editor’s note: Yoav Shoham is professor of computer science at Stanford… http://goo.gl/fb/0r8p9"
"94911705666166785"	"andijoe54"	"RL2013D03E087"	"Denco Sports Luggage Stanford University 27 Rolling Duffel Black Wheeled Duffels: Traveling students, alumni, fa... http://bit.ly/o76ejm"
"94933373449027584"	"K5H4ZYR"	"RL2013D03E087"	"@Eliora_A , @FukAHoe , @shane_stanford and @JayaRankin unfollowed me today ... checked by http://fllwrs.com"
"95164672533213184"	"BCrouch_22"	"RL2013D03E087"	"Good luck to my BSA boys at nationals@ @critkezmarsky @major25canady @nic_wells21 @Corey_Stanford#BSAElite"
"95239687647674368"	"sluggahjells"	"RL2013D03E087"	"@Ataraxis00 Just them hyping up Stanford since they all showed the possible quarterfinal matchups there."
"95264379502739456"	"6dozenballs"	"RL2013D03E087"	"Ula Rad won her first match in 2 sets in Stanford. She needs to extent that streak to qualify for the main draw."
"95270268326522880"	"justintimetv"	"RL2013D03E087"	"We just finished installing DIRECTV at @Stanford, looking for industry-specific coverage at @Brandweek!"
"95438896137113600"	"money007sniper"	"RL2013D03E087"	"NSF Awards $10 Million Grant to Stanford University to Launch..."
"95451994919145472"	"radiohouseschuh"	"RL2013D03E087"	"#nowplaying: Mell Tierra & Sebastian D ft. Stanford - Maximize"
"95489533973512192"	"kevinablue"	"RL2013D03E087"	"Budget not the whole story - we beat schools with bigger budgets: Stanford has choke hold on Directors' Cup http://www.oregonlive.com/pac-12/index.ssf/2011/07/the_bachscore_stanford_has_choke-hold_on_directors_cup.html … #gostanford"
"95600905289859072"	"4Hypertension"	"RL2013D03E087"	"Leaders needed for chronic disease programs: Workshops use the Stanford Chronic Disease Self-Management Program ... http://bit.ly/nQKemO"
"95619943239925760"	"Kade25"	"RL2013D03E087"	"http://twitgoo.com/2ko40k had a great time at the Stanford Camp :) #Stanford"
"95620241048088576"	"SleepAndDreams"	"RL2013D03E087"	"Stanford Sleep Center's athletic performance study by Cheri Mah garnering more discussion, now from @thesleepdoctor http://www.theinsomniablog.com/the_insomnia_blog/2011/07/sleep-better-to-play-better.html …"
"95628851958382592"	"mad_for_sport"	"RL2013D03E087"	"#Tennis Stanford Classic results http://yhoo.it/nQfKe3"
"95639870386614273"	"ketfilms"	"RL2013D03E087"	"DMA Central » digital academy film making stanford: Guillermo del Toro has been seriously making movies since th... http://bit.ly/rbn8qk"
"95651123725209600"	"globalnewsscoop"	"RL2013D03E087"	"'He threw in the towel': Stanford's Abbas Milani discusses Ahmadinejad's tumble: What impact is this dispute lik... http://bit.ly/nqkwLn"
"95733839581810688"	"jennigreek"	"RL2013D03E087"	"I'm seriously considering transferring out of USC junior year. If Stanford will take me, definite yes. If UCLA will accept me again - yes."
"95740168799141889"	"lost_la"	"RL2013D03E087"	"Lost golden chihuahua girl on 7/25 at 5 p.m. Ave. Stanford in Valencia in the Industrial Center. She is very timid, ... http://bit.ly/pz7rRu"
"95862847984250880"	"bcondotta"	"RL2013D03E087"	"@tacofro77 Most interested in hearing today?... Maybe Stanford's David Shaw. Really don't know much about him."
"95870980731318272"	"FtblSickness"	"RL2013D03E087"	"Love it. Multiple Stanford bigs follow Coach. RT @TonyPauline: Chase Beeler/C/Stanford has agreed to terms with the San Francisco #49ers..."
"95882634424627200"	"Lockedonsports"	"RL2013D03E087"	"Oregon and Stanford thought of as two best teams in Pac-12 neither on Utah schedule this year - #softlanding"
"95889846702325760"	"ubergizmo"	"RL2013D03E087"	"Stanford researchers create new transparent and flexible battery http://om.ly/BZYty"
"95895546757259265"	"AnujSayal"	"RL2013D03E087"	"Stanford researchers create transparent battery, dream of a see-through iPhone (video): We've had about all ... http://engt.co/qCIh7C"
"95901980857352194"	"TrentyPie"	"RL2013D03E087"	"Woah Cal's division in the PAC 12 has UW WSU UO and OSU along with Stanford. I thought differently"
"95906854793789440"	"pac12"	"RL2013D03E087"	"Stanford coach David Shaw on Andrew Luck's ever-growing beard: ""I just hope his helmet fits."""
"95907490767699968"	"schadjoe"	"RL2013D03E087"	"David Shaw of Stanford a highly intelligent speaker"
"95917644158480385"	"FauxJohnMadden"	"RL2013D03E087"	"Stanford QB Andrew Luck states this will be his last year in school, unless of course the Panthers get the #1 pick again."
"95936726433935360"	"Houndex"	"RL2013D03E087"	"1 step closer!! Stanford researchers create transparent battery, dream of a see-through iPhone (video) http://engt.co/o2vObj"
"95936739042000897"	"daniellebeverly"	"RL2013D03E087"	"Cameralady at Stanford today. Always happy to shoot w/bestie @friskykitty & fantabulous Lauretta Molitor http://yfrog.com/gzrdleej "
"95960768192839680"	"ghadasha"	"RL2013D03E087"	"Look up Gerhart Casper .. He is the master of espionage as an expert on Democracy and previous president of Stanford http://yfrog.com/h2gukioj "
"95972248032264192"	"AceGlentura"	"RL2013D03E087"	"@scottstanford1 that's an RT and an actual message from the man himself!! H8ers form an orderly cue behind the number one Scott Stanford fan"
"95991264985616384"	"rayflow17"	"RL2013D03E087"	"Stanford Nebraska I guess I come"
"96007115277213696"	"StanfordSpyder"	"RL2013D03E087"	"[Rivals.com] Luck says he's likely NFL-bound in 2012 (Yahoo! Sports) http://bit.ly/qPv3Q2 #Stanford #Cardinal"
"96021405270945792"	"CHNMedicine"	"RL2013D03E087"	"What Are My Chances For Stanford? I’m An International Student.?: Hi! I’m a prospective international student lo... http://bit.ly/nsSOVr"
"96052800798208000"	"OnTheBaseline"	"RL2013D03E087"	"Serena Williams def. Anastasia Rodionova 6-0, 6-0 to advance to the 2nd round at Stanford. #tennis"
"96204096553484288"	"LowyatNET"	"RL2013D03E087"	"[Frontpage] - Stanford Researchers Take Transparency to Your Phone, Soon http://bit.ly/nzH3NA"
"96212279636393984"	"AKimble5"	"RL2013D03E087"	"Def will be in NC for the Stanford vs Duke football game Sept 10. Going to have to get the Charlotte fam to Durham"
"96268290359435264"	"RobertLangreth"	"RL2013D03E087"	"Stanford shines a bright light on autism cause http://ow.ly/5OKiz"
"96277924705087489"	"irasocol"	"RL2013D03E087"	"@DrGarcia Last year I dug through everything on history from Stanford because I was sure I had missed it, but they've scrubbed their past"
"96282512501899265"	"jmalvpal"	"RL2013D03E087"	"Científicos de Stanford crean una batería de litio transparente. @alt1040. http://bit.ly/mPpjqQ"
"96299621831290880"	"Una_fuente"	"RL2013D03E087"	"Científicos de Stanford inventan baterías transparentes para gadgets http://unafuente.com/?p=162137 "
"96318164840882176"	"StanfordSpyder"	"RL2013D03E087"	"[SB Nation: Rule Of Tree] 2011 Football Media Guide Hits the Net http://bit.ly/peceLi #Stanford #Cardinal"
"96321901965750272"	"willie_t_smith"	"RL2013D03E087"	"Do your thang RT @usta: @serenawilliams blanked Anastasia Rodionova 6-0, 6-0 at Stanford's @BankOfTheWestC… (cont) http://deck.ly/~mprjt"
"96329485292539904"	"Steren_Mexico"	"RL2013D03E087"	"Tecnología para todos los gustos: Científicos de Stanford inventan batería transparente: http://ow.ly/5OY3f vía @alt1040"
"96369834463461376"	"Bay_AllDay"	"RL2013D03E087"	"@MarshDiggler Sorry dude, but Stanford's taking the Pac 12"
"96452327623495680"	"Arindam_IIPM"	"RL2013D03E087"	"Latest News from IIPM Facebook: GOP on Supply Chain Management by Prof. Gal Raz from Stanford University @ IIPM Mumbai http://goo.gl/XBF5c"
"96454156772065280"	"MaudeLuG0NS192"	"RL2013D03E087"	"Key immune substance linked to asthma, Stanford study finds http://bit.ly/qAvcHr  asthma treatments"
"96533647221460992"	"albraleo"	"RL2013D03E087"	"Científicos de Stanford crean baterías transparentes porque 'quieren un iPhone transparente'... http://bit.ly/nSVVii"
"96545630343798785"	"mmuthe"	"RL2013D03E087"	"""Wishful thinking and fearful thinking"" -Prof. Donald Emmerson from Stanford"
"96584750633988097"	"J3AnRa"	"RL2013D03E087"	"Tecnologia: Científicos de Stanford crean baterías transparentes porque ‘quieren un iPhone trans... http://bit.ly/nMJaTB #mexico #xalapa"
"96608985284755456"	"Tennis_RT"	"RL2013D03E087"	"RT @sharapovatennis Stanford 2rd: Photos and video. http://bit.ly/roN1iK #Sharapova #Tennis"
"96651364570107904"	"amylockwood"	"RL2013D03E087"	"Is 1 death really a tragedy and 1 million a statistic? New research into #compassion from #stanford http://www.ssireview.org/articles/entry/research_the_emotions_of_aid/?utm_source=Enews07_28_11&utm_medium=email&utm_campaign=Emotions_of_Aid …"
"96657790206083072"	"wetwarehacker"	"RL2013D03E087"	"Overexcited Brain Cells May Spur Symptoms of Autism, Stanford Study Finds http://bloom.bg/pKHwwN "
"96691273351708672"	"CIRMnews"	"RL2013D03E087"	"Great read: Stanford law prof Hank Greely's summary of the Lamberth ruling on embryonic #stemcell research: http://tinyurl.com/3ol9c6q"
"96698146889015298"	"StanfordCorpGov"	"RL2013D03E087"	"US default would spell turmoil for the repo market-Q&A with Stanford GSB Prof Duffie/Prof Kashyap, Chicago Booth FT.com: http://www.ft.com/intl/cms/s/0/190a2cd6-b925-11e0-bd87-00144feabdc0.html …"
"96706280575602688"	"CecilHurt"	"RL2013D03E087"	"@MikeGriffith32 I assume they mean schools (Penn State and Stanford). Many coaches haven't had 1. (Paterno, Mack Brown off top of head...)"
"96736047559475201"	"kingF0X23"	"RL2013D03E087"	"@WillFrasure ""With the #1 pick in the 2012 NFL draft, the Bengals select....Andrew Luck QB, Stanford and lose CB Leon Hall in FA"""
"96739222995730435"	"FastCoLead"	"RL2013D03E087"	"Stanford Brings Affordable Medical Innovation To India Through Collaborative Design - http://bit.ly/jdplc2 "
"96752824758710272"	"limweeliam"	"RL2013D03E087"	"17. Erakovic upsets top-seeded Azarenka at Stanford: STANFORD, California (AP): New Zealand qualifier Marina Era... http://bit.ly/n4W5iy"
"96757585289543680"	"ryancanulla"	"RL2013D03E087"	"ha-ha rude bostonians drove him from MIT! RT @jhooks: 19 year-old Stanford Ph.D. dropout Andrew Hsu is Changing Education http://j.mp/oQj3xZ"
"96771451658579968"	"m_vernon"	"RL2013D03E087"	"@John_Stanford Your taking a pit stop, right? #chilltime If you know what I mean"
"96866528166813696"	"GonzaloSmo"	"RL2013D03E087"	"Científicos de Stanford crean una batería transparente: En los últimos años hemos sido testigos de la aparición ... http://bit.ly/nKXOpo"
"96867849376768000"	"CalvoSanBruno"	"RL2013D03E087"	"RT @GonzaloSmo: Científicos de Stanford crean una batería transparente. Múltiples aplicaciones ... http://bit.ly/nKXOpo"
"96914057998774272"	"AllAboutFashion"	"RL2013D03E087"	"New Stanford coach David Shaw just might fill his predecessor's big shoes http://bit.ly/qA7rFR"
"96956277862838272"	"batchboy999"	"RL2013D03E087"	"Log tossed to Stanford biology grads: Q: what is that made of? 95% thought minerals in dirt! No, its mostly carbon out of CO2 from the air!"
"96968776901345280"	"jason1040"	"RL2013D03E087"	"In a @SportsNation poll winning at Stanford and Duke is harder than winning at Vanderbilt...people are stupid. SEC football > Pac12 & ACC"
"96973369651634177"	"KenGoe"	"RL2013D03E087"	"Coaching is in the genes for Stanford's David Shaw: http://bit.ly/r478nL"
"96981267417022464"	"Biotechnology"	"RL2013D03E087"	"Interrupted Sleep Takes a Toll on Memory Formation, Stanford University Study: A new study seems to confirm what... http://bit.ly/rgsda6"
"96981582086291457"	"SerenaPlays"	"RL2013D03E087"	"The Bank of the West Classic in Stanford will see Maria Sharapova and _Serena Williams_ meet in the quarterfinals of... http://dlvr.it/d4YBX"
"96992256589959170"	"jordynnicolle"	"RL2013D03E087"	"I'm at Stanford Pool (7350 E. Rosadene Lane, Columbia) http://4sq.com/qVL1hI"
"97006986989801472"	"berser1"	"RL2013D03E087"	"Flexible nanowire electronics that can attach to any material developed at Stanford http://anpron.eu/?p=16638 "
"97016944275894272"	"lisasunbury"	"RL2013D03E087"	"Promoting Life Skills Early: Lessons From Stanford, UCLA, And Harvard http://www.huffingtonpost.com/ellen-galinsky/promoting-life-skills-ear_b_913187.html … > What's Important: Perspective Taking #ece"
"97040577245347842"	"AndyLucksBeard"	"RL2013D03E087"	"I have seen Matt Barkley's baby face, and quite frankly, it offends me. #gostanford #Luck4Heisman #Stanford"
"97054352224698368"	"ScottEnyeart"	"RL2013D03E087"	"Everyone gets on Pete Carroll for signing USC guys - yet Harbaugh and the 49ers have signed 4 UDFA's from Stanford so far"
"97077442925166593"	"JeanPierreLevac"	"RL2013D03E087"	"RT @fssimon: Promoting Life Skills Early: Lessons from Stanford, UCLA, and Harvard by @ellengalinsky http://ow.ly/5QG4p"
"97090608832843777"	"FamousAmos264"	"RL2013D03E087"	"@Ryanjmal andrew luck is gonna graduate from stanford with his degree and still be the number 1 pick next year. That nigga is straight"
"97093456790433792"	"ExpertusONE"	"RL2013D03E087"	"@anicole87 > Allison - thx for RT of the Stanford piece re: Organizational Learning theory & practice. Have a great weekend!"
"97144329491066882"	"OumLulla"	"RL2013D03E087"	"I'm at Sony Ericsson Tennis Hotspot (Taube Family Tennis Stadium, Stanford University, Stanford, CA) w/ 5 others http://4sq.com/qCd5Rg"
"97170711671611393"	"SmashUrEnemies"	"RL2013D03E087"	"Stanford Routt #shittingpants"
"97173400212086784"	"TheSportsShop1"	"RL2013D03E087"	"Serena routs Sharapova to advance at Stanford: Serena Williams put on a clinic with precision serving and a sharp... http://es.pn/p4ltrE"
"97174431998291969"	"mad_for_sport"	"RL2013D03E087"	"#Tennis WTA Stanford results http://yhoo.it/or1z37"
"97176034247581696"	"JEJEZNOVIA"	"RL2013D03E087"	"I'm at Sony Ericsson Tennis Hotspot (Taube Family Tennis Stadium, Stanford University, Stanford, CA) w/ 10 others http://4sq.com/o4o3Cr"
"97188101235023873"	"harithamtech"	"RL2013D03E087"	"Microsoft's massive database for the locations-Stanford researcher exposes.check this out !!! #technology #smallbiz http://cnet.co/qeo4Gi "
"97189321785884672"	"bypassrider"	"RL2013D03E087"	"Serena routs Sharapova to advance at Stanford http://bit.ly/n2rQVZ"
"97190861116411904"	"soyuclub"	"RL2013D03E087"	"Serena easily routs Sharapova to reach Stanford semis: Source: www.cbssports.com --- Friday, July 29, 2011Unseed... http://bit.ly/o9V07q"
"97190865302335488"	"soyuclub"	"RL2013D03E087"	"Serena sweeps Sharapova to reach Stanford semis: Source: www.tennis.com --- Friday, July 29, 2011STANFORD, Calif... http://bit.ly/pgTYJ4"
"97279457374642177"	"cnina86"	"RL2013D03E087"	"Tennis Notebook: A wake up call for Sharapova in Stanford http://tennisnotebook.blogspot.com/2011/07/wake-up-call-for-sharapova-in-stanford.html?spref=tw …"
"97339767276048384"	"ESPNDeportes"	"RL2013D03E087"	"Stanford: Serena Williams eliminó a Sharapova: STANFORD -- La estadounidense Serena Williams se tropezó una vez a... http://es.pn/n6jo2D"
"97344705469222912"	"Photocritic"	"RL2013D03E087"	"Stanford University are doing a free Introduction to Artificial Intelligence class. http://bit.ly/pQxAbQ #Enrolled."
"97376278692376577"	"monk51295"	"RL2013D03E087"	"@ryanbretag stanford stuff - originally from @OlsonKirsten 's http://tinyurl.com/3muckth - but i've seen several articles saying the same"
"97381194429247488"	"pixiestix1207"	"RL2013D03E087"	"RT @Stanford Prof. Helen Quinn calling for a new, more engaging approach to K-12 science education #BrighterFuture http://bit.ly/n2CF22"
"97456415060410368"	"golfwizard372"	"RL2013D03E087"	"Stanford research team studies perfect golf swing http://bit.ly/oLfZCL"
"97477847958040576"	"AminPali"	"RL2013D03E087"	"I'm at Stanford Shopping Center (660 Stanford Shopping Center, at El Camino Real & Sand Hill Rd, Palo Alto) [pic]: http://4sq.com/oBc96o"
"97501122150928384"	"afgiel"	"RL2013D03E087"	"Stanford kids, how they vary"
"97506004308209664"	"tennis_updates"	"RL2013D03E087"	"Serena Williams def. Sabine Lisicki 6-1 6-2 to reach @BankoftheWestCl final, where she'll play Marion Bartoli for the title. #Stanford"
"97572286923677696"	"Azernewsonline"	"RL2013D03E087"	"Serena to meet Bartoli in Stanford: Serena Williams continued her stroll through the Bank of the West Classic as... http://bit.ly/rtShd5"
"97579404628209664"	"TheWcDaunnY"	"RL2013D03E087"	"Serena storms into Stanford final: Serena Williams marches into the final of the Bank of The Wes... http://bbc.in/qWfGt6 #TeamFollowBack"
"97661789176737792"	"EduardoPoza"	"RL2013D03E087"	"#WTA STANFORD F Marion Bartoli en la Final por lesión abdominal de Cibulkova, y ante Serena Williams que batió a Lisicki 6-1 6-2 #tennis"
"97668508434968577"	"SportsBizMiss"	"RL2013D03E087"	"Just voted in a preseason CFB poll for @onside_kick. My top 5? Alabama, Oklahoma, LSU, Oregon, Stanford."
"97697335882158080"	"parsons6"	"RL2013D03E087"	"@elliepressive highbury would still be better than stanford bridge lol xxxx"
"97724615631187968"	"BayphotoNet"	"RL2013D03E087"	"Will take wedding portraits for Pan & Zhang at Stanford University, Palo Alto today!"
"97736934306230273"	"iNeeedMoneyy"	"RL2013D03E087"	"Lol the homie said ""Bompton"" is when you get to Stanford Ave @Leshia_Minaj"
"97755259224592384"	"SebastianCala"	"RL2013D03E087"	"@luis_yanguas Podes probar refreescando la pagina de http://www.tenisenvivo.com.ar y haciendo click en Stanford. Espero te sirva"
"97761668137889794"	"callejamac"	"RL2013D03E087"	"Serena gana el primer set a Bartoli 7/5 en la final de Stanford. Ha levantado dos veces un break en contra."
"97776920757944321"	"TennisReporters"	"RL2013D03E087"	"2011 Stanford is Serena's FIRST summer hardcourt title outside of US Open since she went back to back in LA in 1999-2000. Amazing 2 me"
"97777522590228480"	"natasha287"	"RL2013D03E087"	"i love that Serena William's has just won the Stanford hardcourt title !!! NR x"
"97787005924155392"	"hamletradiohead"	"RL2013D03E087"	"I'm at See's Candies - Stanford Shopping Center (131 Stanford Shopping Center, Palo Alto) http://4sq.com/nFjMTk"
"97794408870719489"	"ruslanvertov"	"RL2013D03E087"	"Serena ends trophy drought at Stanford: Serena Williams captures her first title in over a year as she breezes p... http://bit.ly/o4dOQt"
"97808724026081280"	"PeopleNetworkco"	"RL2013D03E087"	"Serena Williams captures 1st title in comeback: STANFORD, Calif. -- Serena Williams has captured her first tourn... http://bit.ly/osdhlp"
"97836041502863360"	"FitnHealthy_C"	"RL2013D03E087"	"Those with migraines may get fresh aid at Stanford (Seattle Post Intelligencer) http://feedzil.la/o6iu5e"
"97923249500979201"	"soyuclub"	"RL2013D03E087"	"Serena lays down US Open marker with Stanford title: Source: af.reuters.com --- Sunday, July 31, 2011STANFORD, C... http://bit.ly/p30nxL"
"97924117717712896"	"Tennis_RT"	"RL2013D03E087"	"RT @Ladies_Tennis #ab #tennis #ladies Stanford Recap: Serena, Sharapova, Lisicki, and More! – 10sBalls: msnbc.com Stanford Recap: ......"
"98004153422462976"	"TWIZZLERSRAW"	"RL2013D03E087"	"Serena Williams's show her victory at the Stanford Classic** old happy days old happy days are here again? http://yfrog.com/h3vb2gfj"
"98004501562261504"	"Tennis_Now"	"RL2013D03E087"	"Article Serena Williams back in Top 80 after Stanford win http://bit.ly/p3R3ZG"
"98013309579698176"	"VinicioCuevas"	"RL2013D03E087"	"Serena venció a Bartoli y ganó WTA Stanford: La tenista estadounidense Serena Williams venció por 7-5... http://es.pn/q4eGTT"
"98026819428687872"	"marcosaqr"	"RL2013D03E087"	"La electrónica con nanocables desarrollada en Stanford podrá usarse en cualquier material http://dlvr.it/dPQSJ"
"98028394482118658"	"lizardbill"	"RL2013D03E087"	"Stanford offering free, online version of Intro to AI taught by Sebastian Thrun and Peter Norvig. http://www.ai-class.com/ "
"98033274458349568"	"StanfordSpyder"	"RL2013D03E087"	"[Rivals.com] Stanford Preview: Secondary (Rivals.com) http://bit.ly/nztrYJ #Stanford #Cardinal"
"98079554404499456"	"puresurplus"	"RL2013D03E087"	"Take Stanford's AI Course For Free Online http://bit.ly/rmz5Qc"
"98082815484235776"	"CrainsNewYork"	"RL2013D03E087"	"Race to build NYC applied sciences campus draws @Cornell_Univ @Stanford @TechnionLive @CarnegieMellon @PurdueU + more http://cny.bz/nVYFkR"
"98099083113275392"	"pediastaff"	"RL2013D03E087"	"Overexcited Brain Cells May Spur Symptoms of Autism, Stanford Study Finds http://ht.ly/5SovO #SLPeeps, #OT, #autism"
"98112344315543553"	"niketennis"	"RL2013D03E087"	"Advantage Serena Williams! She served up a win at Stanford this weekend, her first since returning from injury!... http://fb.me/RskjtO7m"
"98112650357125122"	"myrtlegroggins"	"RL2013D03E087"	"THIS!! RT @CastleAddict Alexis, don't become my new #shipperirritant... I'll be buying your plane ticket to Stanford. #Castle"
"98128963314003968"	"Stanford"	"RL2013D03E087"	"Stanford course bulletin for 2011-2012 now online. Check it out here: http://bit.ly/n1Aj8u"
"98175465587605504"	"sskpunk"	"RL2013D03E087"	"Angela Stanford suffers some seriously bad luck Carnoustie ... http://feetinthongsandals.co.cc/womens-summer-sandals-ryka.html …"
"98203886162161664"	"CWHager"	"RL2013D03E087"	"Read Steve Jobs speech he gave at Stanford commencement. Highly recommended. Short and to the point. Just good advice to take."
"98215739298820096"	"NextGenLog"	"RL2013D03E087"	"#NANOTECH: ""Nanocircuits that adhere to any substrate"": Researchers at Stanford University recently demonstrated... http://bit.ly/nNtGQv"
"98248832340590592"	"StanfordSpyder"	"RL2013D03E087"	"[Oakland Tribune] Cal football coach Jeff Tedford expects new backs to contribute http://bit.ly/rmQZgH #Stanford #Cardinal"
"98260375081979906"	"petrjohanes"	"RL2013D03E087"	"The entire system for searching Stanford classes is slowing down due to overload less than 24 hours after enrollment opened :-)"
"98262560310165505"	"tzihua"	"RL2013D03E087"	"@serenawilliams I know you'll probably never see or even reply this but I just want to say congrats on winning Stanford! You deserve it! <3"
"98398607685849089"	"SpeakerBoehner"	"RL2013D03E087"	"Stanford economist John B. Taylor: Budget Control Act “represents a very big shift” in our spending trajectory http://j.mp/pGrgF0 #4jobs"
"98408417198223361"	"ajfeed"	"RL2013D03E087"	"DM+ML Introduction to Artificial Intelligence (free online course): the online version of Stanford course Intro ... http://bit.ly/oC9QVm"
"98414987709657088"	"ShermichaelS"	"RL2013D03E087"	""
"98416171128324096"	"johnboehner"	"RL2013D03E087"	"Stanford economist John Taylor on the Budget Control Act & why it matters: http://bit.ly/qxihdi"
"98418680660115456"	"nuke_news"	"RL2013D03E087"	"""Nuclear Zero? Why Not Nuclear Infinity?"": July 31st, 2011 - CISAC, FSI Stanford Op-edIn a Wall Street Journal ... http://bit.ly/q3QkXW"
"98426259574489088"	"matt_stanford"	"RL2013D03E087"	"Check out this blog by @JennPrentice - Paywall Payday: NY Times Digital Subscriptions Working http://rdsrc.us/SgVf30  via @ExpertsExchange"
"98442139419160576"	"fabaof"	"RL2013D03E087"	"Introduction to Artificial Inteligence in Stanford's AI class online: http://www.ai-class.com/"
"98451392057970688"	"colkm"	"RL2013D03E087"	"Stanford U. Offers Free Online Course in Artificial Intelligence [Article] http://fb.me/GnzjhFb6"
"98459961021050881"	"derekouyang"	"RL2013D03E087"	"Stanford economist: How do we 'get off this path of deficits as far as the eye can see?' http://news.stanford.edu/news/2011/august/shoven-debt-qanda-080211.html … via @stanford"
"98468156699459585"	"DeeJayTopGun"	"RL2013D03E087"	"I'm at Whitten University Center (UC) (1306 Stanford Drive, Coral Gables) http://4sq.com/nNcmqz"
"98468622263009280"	"solangemagalhae"	"RL2013D03E087"	"Paula Creamer : Kerr, Creamer, Stanford lead Americans in Sybase - Pakistan Observer http://uxp.in/39447076"
"98476243309182976"	"ajensen29"	"RL2013D03E087"	"2011 Stanford Football Predictions: It gets Oregon at home this year, and that game could potentially decide who... http://bit.ly/rrsdlU"
"98479460319375360"	"THEworldunirank"	"RL2013D03E087"	"“@EconBizEd: MBA diary: Applying to Stanford took over Temi Olatunde's whole life http://ow.ly/5T99H ”"
"98500515746418688"	"RobCubbon"	"RL2013D03E087"	"Ukrainian politician plagiarizes Steve Jobs’ Stanford speech almost word for word http://thenextweb.com/apple/2011/08/02/ukranian-politican-plagiarizes-steve-jobs%e2%80%99-stanford-speech-almost-word-for-word/ … via @tnwapple"
"98567528120467456"	"reginald_iii"	"RL2013D03E087"	"“ @Stanford: Is “Thinking” or “Feeling” More Persuasive? http://bit.ly/ncGoxy ” 'Think' also sounds more imposing."
"98575191113867264"	"whole_patients"	"RL2013D03E087"	"I need a fairy godmother to send me to this ball: Stanford Med 2.0 http://tinyurl.com/2dx9ug5  #med2 #wishlist #meded"
